{
  "generated_at": "2026-07-09",
  "source_work_queue_generated_at": "2026-07-09",
  "criteria": {
    "visual_review_required": "이미지 원본으로 출입구 단차·경사·바닥재·주차장-출입구 연결 동선을 검수",
    "blocked": "이미지 메타데이터가 없거나 동선 핵심 구간 이미지가 부족하면 hidden 유지"
  },
  "summary": {
    "total": 17,
    "by_status": {
      "open": 17
    },
    "by_review_decision": {
      "pending_visual_review": 17
    },
    "total_roadview_images": 1023,
    "min_images_per_place": 14,
    "max_images_per_place": 168,
    "required_evidence_counts": {
      "entrance_step_or_ramp": 17,
      "main_path_slope": 17,
      "surface_condition": 17,
      "parking_to_entrance_route": 17
    }
  },
  "items": [
    {
      "task_id": "jeju_roadview_place_038_roadview_image_review",
      "card": {
        "id": "jeju_roadview_place_038",
        "name": "국립제주박물관",
        "region": "제주시",
        "category": "indoor",
        "verification_status": "partial"
      },
      "status": "open",
      "review_decision": "pending_visual_review",
      "required_evidence": [
        "entrance_step_or_ramp",
        "main_path_slope",
        "surface_condition",
        "parking_to_entrance_route"
      ],
      "image_count": 132,
      "captured_date_start": "2022-08-23",
      "captured_date_end": "2022-08-23",
      "coordinate_bounds": {
        "min_latitude": 33.51207775,
        "max_latitude": 33.514005527777776,
        "min_longitude": 126.53344444444444,
        "max_longitude": 126.55020275
      },
      "review_image_samples": [
        {
          "image_file_name": "JEJUNATIONALMU-1-001",
          "captured_at": "2022-08-23 09:35",
          "latitude": 33.512772194444445,
          "longitude": 126.54902219444445,
          "resolution": "6720*3360"
        },
        {
          "image_file_name": "JEJUNATIONALMU-1-027",
          "captured_at": "2022-08-23 11:38",
          "latitude": 33.51333888888889,
          "longitude": 126.54957222222222,
          "resolution": "6720*3360"
        },
        {
          "image_file_name": "JEJUNATIONALMU-1-053",
          "captured_at": "2022-08-23 11:26",
          "latitude": 33.51292775,
          "longitude": 126.54867219444444,
          "resolution": "6720*3360"
        },
        {
          "image_file_name": "JEJUNATIONALMU-2-019",
          "captured_at": "2022-08-23 10:32",
          "latitude": 33.513288861111114,
          "longitude": 126.54857497222223,
          "resolution": "6720*3360"
        },
        {
          "image_file_name": "JEJUNATIONALMU-2-045",
          "captured_at": "2022-08-23 10:54",
          "latitude": 33.51295277777778,
          "longitude": 126.54939722222223,
          "resolution": "6720*3360"
        },
        {
          "image_file_name": "JEJUNATIONALMU-2-070",
          "captured_at": "2022-08-23 11:07",
          "latitude": 33.51332222222222,
          "longitude": 126.54959719444444,
          "resolution": "6720*3360"
        }
      ],
      "field_evidence": [
        {
          "field": "entrance_step_or_ramp",
          "status": "pending_visual_review",
          "image_file_names": [
            "JEJUNATIONALMU-1-001",
            "JEJUNATIONALMU-1-027",
            "JEJUNATIONALMU-1-053"
          ],
          "note": "대표 이미지와 원본 이미지 시퀀스를 열어 시각 검수 필요"
        },
        {
          "field": "main_path_slope",
          "status": "pending_visual_review",
          "image_file_names": [
            "JEJUNATIONALMU-1-001",
            "JEJUNATIONALMU-1-027",
            "JEJUNATIONALMU-1-053"
          ],
          "note": "대표 이미지와 원본 이미지 시퀀스를 열어 시각 검수 필요"
        },
        {
          "field": "surface_condition",
          "status": "pending_visual_review",
          "image_file_names": [
            "JEJUNATIONALMU-1-001",
            "JEJUNATIONALMU-1-027",
            "JEJUNATIONALMU-1-053"
          ],
          "note": "대표 이미지와 원본 이미지 시퀀스를 열어 시각 검수 필요"
        },
        {
          "field": "parking_to_entrance_route",
          "status": "pending_visual_review",
          "image_file_names": [
            "JEJUNATIONALMU-1-001",
            "JEJUNATIONALMU-1-027",
            "JEJUNATIONALMU-1-053"
          ],
          "note": "대표 이미지와 원본 이미지 시퀀스를 열어 시각 검수 필요"
        }
      ],
      "recommended_action": "대표 이미지와 전체 이미지 시퀀스로 단차·경사·바닥재·주차장 연결 동선을 검수"
    },
    {
      "task_id": "jeju_roadview_place_088_roadview_image_review",
      "card": {
        "id": "jeju_roadview_place_088",
        "name": "김녕미로공원",
        "region": "제주시",
        "category": "rest_area",
        "verification_status": "partial"
      },
      "status": "open",
      "review_decision": "pending_visual_review",
      "required_evidence": [
        "entrance_step_or_ramp",
        "main_path_slope",
        "surface_condition",
        "parking_to_entrance_route"
      ],
      "image_count": 15,
      "captured_date_start": "2022-09-26",
      "captured_date_end": "2022-09-26",
      "coordinate_bounds": {
        "min_latitude": 33.536052749999996,
        "max_latitude": 33.53678330555555,
        "min_longitude": 126.7720138611111,
        "max_longitude": 126.77269997222223
      },
      "review_image_samples": [
        {
          "image_file_name": "GIMNYEONGMAZEPA-1-001",
          "captured_at": "2022-09-26 10:38",
          "latitude": 33.53617222222222,
          "longitude": 126.77208611111111,
          "resolution": "6720*3360"
        },
        {
          "image_file_name": "GIMNYEONGMAZEPA-1-004",
          "captured_at": "2022-09-26 10:40",
          "latitude": 33.536052749999996,
          "longitude": 126.7720138611111,
          "resolution": "6720*3360"
        },
        {
          "image_file_name": "GIMNYEONGMAZEPA-1-007",
          "captured_at": "2022-09-26 10:42",
          "latitude": 33.536252749999996,
          "longitude": 126.77208333333333,
          "resolution": "6720*3360"
        },
        {
          "image_file_name": "GIMNYEONGMAZEPA-1-009",
          "captured_at": "2022-09-26 10:44",
          "latitude": 33.53635275,
          "longitude": 126.77225833333333,
          "resolution": "6720*3360"
        },
        {
          "image_file_name": "GIMNYEONGMAZEPA-1-012",
          "captured_at": "2022-09-26 10:45",
          "latitude": 33.53641111111111,
          "longitude": 126.77243052777777,
          "resolution": "6720*3360"
        },
        {
          "image_file_name": "GIMNYEONGMAZEPA-1-015",
          "captured_at": "2022-09-26 10:48",
          "latitude": 33.53678330555555,
          "longitude": 126.77269444444444,
          "resolution": "6720*3360"
        }
      ],
      "field_evidence": [
        {
          "field": "entrance_step_or_ramp",
          "status": "pending_visual_review",
          "image_file_names": [
            "GIMNYEONGMAZEPA-1-001",
            "GIMNYEONGMAZEPA-1-004",
            "GIMNYEONGMAZEPA-1-007"
          ],
          "note": "대표 이미지와 원본 이미지 시퀀스를 열어 시각 검수 필요"
        },
        {
          "field": "main_path_slope",
          "status": "pending_visual_review",
          "image_file_names": [
            "GIMNYEONGMAZEPA-1-001",
            "GIMNYEONGMAZEPA-1-004",
            "GIMNYEONGMAZEPA-1-007"
          ],
          "note": "대표 이미지와 원본 이미지 시퀀스를 열어 시각 검수 필요"
        },
        {
          "field": "surface_condition",
          "status": "pending_visual_review",
          "image_file_names": [
            "GIMNYEONGMAZEPA-1-001",
            "GIMNYEONGMAZEPA-1-004",
            "GIMNYEONGMAZEPA-1-007"
          ],
          "note": "대표 이미지와 원본 이미지 시퀀스를 열어 시각 검수 필요"
        },
        {
          "field": "parking_to_entrance_route",
          "status": "pending_visual_review",
          "image_file_names": [
            "GIMNYEONGMAZEPA-1-001",
            "GIMNYEONGMAZEPA-1-004",
            "GIMNYEONGMAZEPA-1-007"
          ],
          "note": "대표 이미지와 원본 이미지 시퀀스를 열어 시각 검수 필요"
        }
      ],
      "recommended_action": "대표 이미지와 전체 이미지 시퀀스로 단차·경사·바닥재·주차장 연결 동선을 검수"
    },
    {
      "task_id": "jeju_roadview_place_100_roadview_image_review",
      "card": {
        "id": "jeju_roadview_place_100",
        "name": "삼성혈",
        "region": "제주시",
        "category": "culture",
        "verification_status": "partial"
      },
      "status": "open",
      "review_decision": "pending_visual_review",
      "required_evidence": [
        "entrance_step_or_ramp",
        "main_path_slope",
        "surface_condition",
        "parking_to_entrance_route"
      ],
      "image_count": 52,
      "captured_date_start": "2022-09-29",
      "captured_date_end": "2022-09-29",
      "coordinate_bounds": {
        "min_latitude": 33.50381386111111,
        "max_latitude": 33.50555830555555,
        "min_longitude": 126.52780830555555,
        "max_longitude": 126.52959719444445
      },
      "review_image_samples": [
        {
          "image_file_name": "SAMSUNGHYEOL-1-001",
          "captured_at": "2022-09-29 15:04",
          "latitude": 33.505363861111114,
          "longitude": 126.52866108333333,
          "resolution": "6720*3360"
        },
        {
          "image_file_name": "SAMSUNGHYEOL-1-011",
          "captured_at": "2022-09-29 15:12",
          "latitude": 33.504805555555556,
          "longitude": 126.52900552777778,
          "resolution": "6720*3360"
        },
        {
          "image_file_name": "SAMSUNGHYEOL-1-021",
          "captured_at": "2022-09-29 15:19",
          "latitude": 33.50418611111111,
          "longitude": 126.52958052777778,
          "resolution": "6720*3360"
        },
        {
          "image_file_name": "SAMSUNGHYEOL-1-032",
          "captured_at": "2022-09-29 15:25",
          "latitude": 33.50437497222222,
          "longitude": 126.52791944444445,
          "resolution": "6720*3360"
        },
        {
          "image_file_name": "SAMSUNGHYEOL-1-042",
          "captured_at": "2022-09-29 15:39",
          "latitude": 33.50495,
          "longitude": 126.52839441666667,